{
  "$schema": "../../schema/duelist.schema.json",
  "id": "teana-2nd",
  "number": 20,
  "name": "Teana 2nd",
  "portrait": {
    "source": "yugipedia",
    "url": "https://ms.yugipedia.com/3/32/Teana-FMR.png",
    "width": 144,
    "height": 163
  },
  "deck": [
    { "card": 24, "weight": 32 },
    { "card": 58, "weight": 32 },
    { "card": 90, "weight": 80 },
    { "card": 109, "weight": 48 },
    { "card": 111, "weight": 80 },
    { "card": 126, "weight": 48 },
    { "card": 130, "weight": 48 },
    { "card": 134, "weight": 48 },
    { "card": 170, "weight": 48 },
    { "card": 192, "weight": 32 },
    { "card": 198, "weight": 48 },
    { "card": 208, "weight": 48 },
    { "card": 229, "weight": 48 },
    { "card": 260, "weight": 48 },
    { "card": 264, "weight": 48 },
    { "card": 276, "weight": 48 },
    { "card": 312, "weight": 80 },
    { "card": 320, "weight": 48 },
    { "card": 321, "weight": 80 },
    { "card": 330, "weight": 48 },
    { "card": 331, "weight": 48 },
    { "card": 332, "weight": 48 },
    { "card": 333, "weight": 48 },
    { "card": 334, "weight": 48 },
    { "card": 335, "weight": 48 },
    { "card": 393, "weight": 32 },
    { "card": 395, "weight": 32 },
    { "card": 396, "weight": 80 },
    { "card": 399, "weight": 32 },
    { "card": 429, "weight": 48 },
    { "card": 492, "weight": 48 },
    { "card": 540, "weight": 48 },
    { "card": 582, "weight": 48 },
    { "card": 584, "weight": 48 },
    { "card": 592, "weight": 48 },
    { "card": 601, "weight": 48 },
    { "card": 608, "weight": 48 },
    { "card": 616, "weight": 48 },
    { "card": 633, "weight": 80 },
    { "card": 659, "weight": 80 }
  ],
  "drops": {
    "S/A-POW": [
      { "card": 19, "weight": 8 },
      { "card": 24, "weight": 182 },
      { "card": 58, "weight": 182 },
      { "card": 167, "weight": 182 },
      { "card": 330, "weight": 38 },
      { "card": 393, "weight": 182 },
      { "card": 395, "weight": 182 },
      { "card": 398, "weight": 182 },
      { "card": 399, "weight": 182 },
      { "card": 402, "weight": 182 },
      { "card": 469, "weight": 182 },
      { "card": 475, "weight": 182 },
      { "card": 527, "weight": 182 }
    ],
    "B/C/D": [
      { "card": 19, "weight": 8 },
      { "card": 24, "weight": 182 },
      { "card": 58, "weight": 182 },
      { "card": 167, "weight": 182 },
      { "card": 330, "weight": 38 },
      { "card": 393, "weight": 182 },
      { "card": 395, "weight": 182 },
      { "card": 398, "weight": 182 },
      { "card": 399, "weight": 182 },
      { "card": 402, "weight": 182 },
      { "card": 469, "weight": 182 },
      { "card": 475, "weight": 182 },
      { "card": 527, "weight": 182 }
    ],
    "S/A-TEC": [
      { "card": 19, "weight": 6 },
      { "card": 24, "weight": 172 },
      { "card": 58, "weight": 172 },
      { "card": 167, "weight": 172 },
      { "card": 302, "weight": 18 },
      { "card": 312, "weight": 18 },
      { "card": 330, "weight": 30 },
      { "card": 336, "weight": 16 },
      { "card": 345, "weight": 18 },
      { "card": 350, "weight": 32 },
      { "card": 393, "weight": 172 },
      { "card": 395, "weight": 172 },
      { "card": 398, "weight": 172 },
      { "card": 399, "weight": 172 },
      { "card": 402, "weight": 172 },
      { "card": 469, "weight": 172 },
      { "card": 475, "weight": 172 },
      { "card": 527, "weight": 172 },
      { "card": 681, "weight": 16 },
      { "card": 699, "weight": 2 }
    ]
  }
}
