{
  "$schema": "../../schema/duelist.schema.json",
  "id": "isis",
  "number": 16,
  "name": "Isis",
  "portrait": {
    "source": "yugipedia",
    "url": "https://ms.yugipedia.com/7/7a/Isis-FMR.png",
    "width": 166,
    "height": 166
  },
  "deck": [
    { "card": 4, "weight": 10 },
    { "card": 7, "weight": 10 },
    { "card": 10, "weight": 10 },
    { "card": 31, "weight": 10 },
    { "card": 60, "weight": 10 },
    { "card": 70, "weight": 10 },
    { "card": 71, "weight": 10 },
    { "card": 73, "weight": 10 },
    { "card": 89, "weight": 80 },
    { "card": 94, "weight": 10 },
    { "card": 122, "weight": 10 },
    { "card": 131, "weight": 10 },
    { "card": 140, "weight": 10 },
    { "card": 150, "weight": 10 },
    { "card": 152, "weight": 10 },
    { "card": 168, "weight": 10 },
    { "card": 177, "weight": 10 },
    { "card": 193, "weight": 10 },
    { "card": 196, "weight": 10 },
    { "card": 199, "weight": 10 },
    { "card": 200, "weight": 10 },
    { "card": 205, "weight": 10 },
    { "card": 206, "weight": 10 },
    { "card": 217, "weight": 10 },
    { "card": 223, "weight": 80 },
    { "card": 227, "weight": 10 },
    { "card": 230, "weight": 10 },
    { "card": 243, "weight": 10 },
    { "card": 247, "weight": 10 },
    { "card": 249, "weight": 10 },
    { "card": 251, "weight": 10 },
    { "card": 258, "weight": 10 },
    { "card": 265, "weight": 10 },
    { "card": 270, "weight": 10 },
    { "card": 289, "weight": 10 },
    { "card": 292, "weight": 10 },
    { "card": 296, "weight": 10 },
    { "card": 298, "weight": 10 },
    { "card": 334, "weight": 80 },
    { "card": 341, "weight": 80 },
    { "card": 348, "weight": 160 },
    { "card": 349, "weight": 80 },
    { "card": 353, "weight": 10 },
    { "card": 357, "weight": 10 },
    { "card": 361, "weight": 10 },
    { "card": 383, "weight": 10 },
    { "card": 393, "weight": 10 },
    { "card": 398, "weight": 10 },
    { "card": 430, "weight": 10 },
    { "card": 431, "weight": 10 },
    { "card": 432, "weight": 10 },
    { "card": 435, "weight": 10 },
    { "card": 436, "weight": 10 },
    { "card": 439, "weight": 10 },
    { "card": 440, "weight": 10 },
    { "card": 442, "weight": 80 },
    { "card": 443, "weight": 80 },
    { "card": 444, "weight": 10 },
    { "card": 445, "weight": 10 },
    { "card": 446, "weight": 10 },
    { "card": 447, "weight": 10 },
    { "card": 448, "weight": 10 },
    { "card": 449, "weight": 80 },
    { "card": 450, "weight": 10 },
    { "card": 451, "weight": 80 },
    { "card": 452, "weight": 10 },
    { "card": 474, "weight": 10 },
    { "card": 484, "weight": 10 },
    { "card": 494, "weight": 10 },
    { "card": 497, "weight": 12 },
    { "card": 503, "weight": 10 },
    { "card": 507, "weight": 12 },
    { "card": 519, "weight": 12 },
    { "card": 524, "weight": 8 },
    { "card": 542, "weight": 12 },
    { "card": 543, "weight": 12 },
    { "card": 546, "weight": 12 },
    { "card": 549, "weight": 12 },
    { "card": 550, "weight": 12 },
    { "card": 561, "weight": 10 },
    { "card": 565, "weight": 12 },
    { "card": 583, "weight": 12 },
    { "card": 593, "weight": 12 },
    { "card": 599, "weight": 12 },
    { "card": 602, "weight": 12 },
    { "card": 603, "weight": 10 },
    { "card": 605, "weight": 12 },
    { "card": 606, "weight": 12 },
    { "card": 613, "weight": 12 },
    { "card": 615, "weight": 12 },
    { "card": 617, "weight": 12 },
    { "card": 624, "weight": 12 },
    { "card": 625, "weight": 12 },
    { "card": 626, "weight": 12 },
    { "card": 634, "weight": 12 },
    { "card": 639, "weight": 12 },
    { "card": 646, "weight": 12 },
    { "card": 647, "weight": 12 },
    { "card": 664, "weight": 80 },
    { "card": 672, "weight": 80 },
    { "card": 692, "weight": 80 }
  ],
  "drops": {
    "S/A-POW": [
      { "card": 4, "weight": 44 },
      { "card": 10, "weight": 44 },
      { "card": 20, "weight": 10 },
      { "card": 31, "weight": 50 },
      { "card": 70, "weight": 50 },
      { "card": 71, "weight": 50 },
      { "card": 122, "weight": 44 },
      { "card": 140, "weight": 44 },
      { "card": 152, "weight": 44 },
      { "card": 168, "weight": 50 },
      { "card": 177, "weight": 44 },
      { "card": 193, "weight": 44 },
      { "card": 196, "weight": 44 },
      { "card": 199, "weight": 44 },
      { "card": 200, "weight": 44 },
      { "card": 205, "weight": 50 },
      { "card": 206, "weight": 50 },
      { "card": 227, "weight": 50 },
      { "card": 230, "weight": 50 },
      { "card": 243, "weight": 50 },
      { "card": 247, "weight": 50 },
      { "card": 249, "weight": 10 },
      { "card": 251, "weight": 50 },
      { "card": 258, "weight": 50 },
      { "card": 265, "weight": 50 },
      { "card": 270, "weight": 50 },
      { "card": 289, "weight": 50 },
      { "card": 292, "weight": 50 },
      { "card": 296, "weight": 50 },
      { "card": 298, "weight": 50 },
      { "card": 331, "weight": 30 },
      { "card": 334, "weight": 30 },
      { "card": 393, "weight": 50 },
      { "card": 430, "weight": 72 },
      { "card": 431, "weight": 72 },
      { "card": 440, "weight": 50 },
      { "card": 448, "weight": 10 },
      { "card": 454, "weight": 10 },
      { "card": 456, "weight": 10 },
      { "card": 517, "weight": 10 },
      { "card": 530, "weight": 44 },
      { "card": 550, "weight": 46 },
      { "card": 596, "weight": 50 },
      { "card": 615, "weight": 46 },
      { "card": 621, "weight": 10 },
      { "card": 625, "weight": 50 },
      { "card": 626, "weight": 50 },
      { "card": 649, "weight": 48 }
    ],
    "B/C/D": [
      { "card": 4, "weight": 64 },
      { "card": 10, "weight": 64 },
      { "card": 20, "weight": 10 },
      { "card": 122, "weight": 64 },
      { "card": 140, "weight": 64 },
      { "card": 152, "weight": 64 },
      { "card": 177, "weight": 64 },
      { "card": 193, "weight": 64 },
      { "card": 196, "weight": 64 },
      { "card": 199, "weight": 64 },
      { "card": 200, "weight": 64 },
      { "card": 205, "weight": 58 },
      { "card": 206, "weight": 58 },
      { "card": 227, "weight": 58 },
      { "card": 243, "weight": 58 },
      { "card": 247, "weight": 58 },
      { "card": 249, "weight": 10 },
      { "card": 251, "weight": 58 },
      { "card": 258, "weight": 58 },
      { "card": 265, "weight": 58 },
      { "card": 270, "weight": 58 },
      { "card": 289, "weight": 58 },
      { "card": 292, "weight": 58 },
      { "card": 296, "weight": 58 },
      { "card": 298, "weight": 58 },
      { "card": 307, "weight": 32 },
      { "card": 315, "weight": 32 },
      { "card": 331, "weight": 32 },
      { "card": 334, "weight": 32 },
      { "card": 393, "weight": 58 },
      { "card": 430, "weight": 88 },
      { "card": 431, "weight": 88 },
      { "card": 448, "weight": 10 },
      { "card": 454, "weight": 10 },
      { "card": 456, "weight": 10 },
      { "card": 517, "weight": 10 },
      { "card": 530, "weight": 48 },
      { "card": 550, "weight": 48 },
      { "card": 615, "weight": 46 },
      { "card": 621, "weight": 10 },
      { "card": 649, "weight": 48 },
      { "card": 686, "weight": 32 }
    ],
    "S/A-TEC": [
      { "card": 4, "weight": 56 },
      { "card": 20, "weight": 8 },
      { "card": 122, "weight": 56 },
      { "card": 140, "weight": 56 },
      { "card": 152, "weight": 56 },
      { "card": 177, "weight": 56 },
      { "card": 199, "weight": 56 },
      { "card": 200, "weight": 56 },
      { "card": 205, "weight": 54 },
      { "card": 206, "weight": 54 },
      { "card": 227, "weight": 54 },
      { "card": 243, "weight": 54 },
      { "card": 247, "weight": 54 },
      { "card": 249, "weight": 10 },
      { "card": 265, "weight": 54 },
      { "card": 270, "weight": 54 },
      { "card": 289, "weight": 54 },
      { "card": 292, "weight": 54 },
      { "card": 296, "weight": 54 },
      { "card": 298, "weight": 54 },
      { "card": 307, "weight": 36 },
      { "card": 311, "weight": 32 },
      { "card": 315, "weight": 36 },
      { "card": 316, "weight": 64 },
      { "card": 317, "weight": 64 },
      { "card": 319, "weight": 36 },
      { "card": 321, "weight": 36 },
      { "card": 322, "weight": 36 },
      { "card": 328, "weight": 36 },
      { "card": 331, "weight": 32 },
      { "card": 334, "weight": 32 },
      { "card": 340, "weight": 36 },
      { "card": 393, "weight": 54 },
      { "card": 431, "weight": 84 },
      { "card": 448, "weight": 10 },
      { "card": 454, "weight": 10 },
      { "card": 456, "weight": 10 },
      { "card": 517, "weight": 10 },
      { "card": 530, "weight": 42 },
      { "card": 621, "weight": 10 },
      { "card": 656, "weight": 32 },
      { "card": 661, "weight": 2 },
      { "card": 663, "weight": 64 },
      { "card": 664, "weight": 32 },
      { "card": 665, "weight": 32 },
      { "card": 672, "weight": 36 },
      { "card": 676, "weight": 32 },
      { "card": 686, "weight": 36 },
      { "card": 687, "weight": 36 },
      { "card": 690, "weight": 36 }
    ]
  }
}
