{
  "$schema": "../../schema/duelist.schema.json",
  "id": "mountain-mage",
  "number": 25,
  "name": "Mountain Mage",
  "portrait": {
    "source": "yugipedia",
    "url": "https://ms.yugipedia.com/0/0a/Mountain_Mage.png",
    "width": 153,
    "height": 190
  },
  "deck": [
    { "card": 4, "weight": 24 },
    { "card": 7, "weight": 32 },
    { "card": 10, "weight": 32 },
    { "card": 13, "weight": 32 },
    { "card": 31, "weight": 32 },
    { "card": 39, "weight": 32 },
    { "card": 45, "weight": 24 },
    { "card": 62, "weight": 32 },
    { "card": 94, "weight": 32 },
    { "card": 117, "weight": 32 },
    { "card": 122, "weight": 32 },
    { "card": 125, "weight": 32 },
    { "card": 168, "weight": 64 },
    { "card": 186, "weight": 32 },
    { "card": 272, "weight": 32 },
    { "card": 294, "weight": 64 },
    { "card": 296, "weight": 32 },
    { "card": 298, "weight": 32 },
    { "card": 300, "weight": 32 },
    { "card": 320, "weight": 64 },
    { "card": 329, "weight": 120 },
    { "card": 332, "weight": 160 },
    { "card": 348, "weight": 40 },
    { "card": 357, "weight": 32 },
    { "card": 383, "weight": 32 },
    { "card": 424, "weight": 32 },
    { "card": 425, "weight": 32 },
    { "card": 458, "weight": 32 },
    { "card": 459, "weight": 32 },
    { "card": 460, "weight": 32 },
    { "card": 461, "weight": 32 },
    { "card": 462, "weight": 32 },
    { "card": 463, "weight": 32 },
    { "card": 464, "weight": 32 },
    { "card": 465, "weight": 32 },
    { "card": 466, "weight": 32 },
    { "card": 468, "weight": 32 },
    { "card": 491, "weight": 32 },
    { "card": 521, "weight": 32 },
    { "card": 522, "weight": 32 },
    { "card": 538, "weight": 32 },
    { "card": 552, "weight": 32 },
    { "card": 555, "weight": 32 },
    { "card": 561, "weight": 32 },
    { "card": 571, "weight": 32 },
    { "card": 577, "weight": 32 },
    { "card": 581, "weight": 32 },
    { "card": 595, "weight": 32 },
    { "card": 603, "weight": 32 },
    { "card": 604, "weight": 64 },
    { "card": 610, "weight": 32 },
    { "card": 636, "weight": 32 },
    { "card": 691, "weight": 48 }
  ],
  "drops": {
    "S/A-POW": [
      { "card": 9, "weight": 72 },
      { "card": 20, "weight": 8 },
      { "card": 24, "weight": 72 },
      { "card": 58, "weight": 72 },
      { "card": 94, "weight": 12 },
      { "card": 111, "weight": 12 },
      { "card": 112, "weight": 11 },
      { "card": 123, "weight": 72 },
      { "card": 146, "weight": 11 },
      { "card": 153, "weight": 11 },
      { "card": 165, "weight": 11 },
      { "card": 167, "weight": 72 },
      { "card": 192, "weight": 72 },
      { "card": 234, "weight": 11 },
      { "card": 241, "weight": 11 },
      { "card": 289, "weight": 72 },
      { "card": 332, "weight": 20 },
      { "card": 384, "weight": 11 },
      { "card": 387, "weight": 72 },
      { "card": 393, "weight": 72 },
      { "card": 396, "weight": 12 },
      { "card": 397, "weight": 72 },
      { "card": 398, "weight": 72 },
      { "card": 399, "weight": 72 },
      { "card": 402, "weight": 72 },
      { "card": 408, "weight": 12 },
      { "card": 409, "weight": 12 },
      { "card": 411, "weight": 72 },
      { "card": 435, "weight": 11 },
      { "card": 437, "weight": 12 },
      { "card": 439, "weight": 12 },
      { "card": 450, "weight": 11 },
      { "card": 458, "weight": 12 },
      { "card": 469, "weight": 72 },
      { "card": 473, "weight": 12 },
      { "card": 475, "weight": 72 },
      { "card": 480, "weight": 11 },
      { "card": 482, "weight": 12 },
      { "card": 484, "weight": 70 },
      { "card": 487, "weight": 12 },
      { "card": 502, "weight": 11 },
      { "card": 504, "weight": 70 },
      { "card": 509, "weight": 6 },
      { "card": 521, "weight": 12 },
      { "card": 527, "weight": 70 },
      { "card": 533, "weight": 12 },
      { "card": 542, "weight": 12 },
      { "card": 547, "weight": 70 },
      { "card": 548, "weight": 70 },
      { "card": 557, "weight": 12 },
      { "card": 558, "weight": 70 },
      { "card": 570, "weight": 11 },
      { "card": 580, "weight": 11 },
      { "card": 618, "weight": 11 },
      { "card": 635, "weight": 70 },
      { "card": 637, "weight": 12 },
      { "card": 707, "weight": 6 },
      { "card": 712, "weight": 12 },
      { "card": 713, "weight": 2 },
      { "card": 714, "weight": 6 }
    ],
    "B/C/D": [
      { "card": 9, "weight": 72 },
      { "card": 20, "weight": 6 },
      { "card": 24, "weight": 72 },
      { "card": 58, "weight": 72 },
      { "card": 94, "weight": 10 },
      { "card": 111, "weight": 10 },
      { "card": 112, "weight": 10 },
      { "card": 123, "weight": 72 },
      { "card": 146, "weight": 10 },
      { "card": 153, "weight": 10 },
      { "card": 165, "weight": 12 },
      { "card": 167, "weight": 74 },
      { "card": 192, "weight": 74 },
      { "card": 234, "weight": 12 },
      { "card": 241, "weight": 12 },
      { "card": 289, "weight": 74 },
      { "card": 332, "weight": 32 },
      { "card": 384, "weight": 12 },
      { "card": 387, "weight": 74 },
      { "card": 393, "weight": 74 },
      { "card": 396, "weight": 10 },
      { "card": 397, "weight": 74 },
      { "card": 398, "weight": 74 },
      { "card": 399, "weight": 74 },
      { "card": 402, "weight": 74 },
      { "card": 408, "weight": 10 },
      { "card": 409, "weight": 10 },
      { "card": 411, "weight": 74 },
      { "card": 435, "weight": 12 },
      { "card": 437, "weight": 10 },
      { "card": 439, "weight": 10 },
      { "card": 450, "weight": 12 },
      { "card": 458, "weight": 10 },
      { "card": 469, "weight": 74 },
      { "card": 473, "weight": 10 },
      { "card": 475, "weight": 74 },
      { "card": 480, "weight": 12 },
      { "card": 482, "weight": 10 },
      { "card": 484, "weight": 72 },
      { "card": 487, "weight": 10 },
      { "card": 502, "weight": 12 },
      { "card": 504, "weight": 72 },
      { "card": 521, "weight": 10 },
      { "card": 527, "weight": 72 },
      { "card": 533, "weight": 10 },
      { "card": 542, "weight": 10 },
      { "card": 547, "weight": 72 },
      { "card": 548, "weight": 72 },
      { "card": 557, "weight": 10 },
      { "card": 558, "weight": 72 },
      { "card": 570, "weight": 12 },
      { "card": 580, "weight": 12 },
      { "card": 618, "weight": 10 },
      { "card": 635, "weight": 72 },
      { "card": 637, "weight": 10 },
      { "card": 659, "weight": 2 },
      { "card": 712, "weight": 6 },
      { "card": 714, "weight": 2 }
    ],
    "S/A-TEC": [
      { "card": 9, "weight": 56 },
      { "card": 20, "weight": 4 },
      { "card": 24, "weight": 56 },
      { "card": 58, "weight": 56 },
      { "card": 112, "weight": 8 },
      { "card": 123, "weight": 56 },
      { "card": 146, "weight": 8 },
      { "card": 153, "weight": 8 },
      { "card": 165, "weight": 8 },
      { "card": 167, "weight": 56 },
      { "card": 192, "weight": 56 },
      { "card": 234, "weight": 8 },
      { "card": 241, "weight": 8 },
      { "card": 289, "weight": 56 },
      { "card": 307, "weight": 18 },
      { "card": 308, "weight": 18 },
      { "card": 309, "weight": 18 },
      { "card": 311, "weight": 18 },
      { "card": 312, "weight": 18 },
      { "card": 323, "weight": 20 },
      { "card": 327, "weight": 20 },
      { "card": 332, "weight": 36 },
      { "card": 336, "weight": 20 },
      { "card": 338, "weight": 36 },
      { "card": 339, "weight": 36 },
      { "card": 340, "weight": 36 },
      { "card": 341, "weight": 24 },
      { "card": 342, "weight": 10 },
      { "card": 345, "weight": 18 },
      { "card": 350, "weight": 36 },
      { "card": 384, "weight": 8 },
      { "card": 387, "weight": 56 },
      { "card": 393, "weight": 56 },
      { "card": 397, "weight": 56 },
      { "card": 398, "weight": 56 },
      { "card": 399, "weight": 60 },
      { "card": 402, "weight": 60 },
      { "card": 411, "weight": 60 },
      { "card": 435, "weight": 8 },
      { "card": 450, "weight": 8 },
      { "card": 469, "weight": 60 },
      { "card": 475, "weight": 60 },
      { "card": 480, "weight": 8 },
      { "card": 484, "weight": 60 },
      { "card": 502, "weight": 8 },
      { "card": 504, "weight": 60 },
      { "card": 527, "weight": 60 },
      { "card": 547, "weight": 60 },
      { "card": 548, "weight": 60 },
      { "card": 558, "weight": 60 },
      { "card": 570, "weight": 8 },
      { "card": 580, "weight": 8 },
      { "card": 635, "weight": 60 },
      { "card": 655, "weight": 18 },
      { "card": 659, "weight": 12 },
      { "card": 665, "weight": 8 },
      { "card": 666, "weight": 8 },
      { "card": 671, "weight": 8 },
      { "card": 673, "weight": 8 },
      { "card": 674, "weight": 8 },
      { "card": 676, "weight": 8 },
      { "card": 677, "weight": 8 },
      { "card": 678, "weight": 8 },
      { "card": 679, "weight": 8 },
      { "card": 680, "weight": 8 },
      { "card": 681, "weight": 12 },
      { "card": 683, "weight": 16 },
      { "card": 690, "weight": 12 },
      { "card": 691, "weight": 8 },
      { "card": 692, "weight": 8 },
      { "card": 693, "weight": 8 },
      { "card": 694, "weight": 8 },
      { "card": 695, "weight": 8 },
      { "card": 697, "weight": 8 },
      { "card": 698, "weight": 8 },
      { "card": 699, "weight": 8 },
      { "card": 700, "weight": 8 }
    ]
  }
}
