{
  "$schema": "../../schema/duelist.schema.json",
  "id": "mai-valentine",
  "number": 11,
  "name": "Mai Valentine",
  "portrait": {
    "source": "yugipedia",
    "url": "https://ms.yugipedia.com/4/47/Mai_Valentine-FMR.png",
    "width": 168,
    "height": 173
  },
  "deck": [
    { "card": 2, "weight": 8 },
    { "card": 6, "weight": 16 },
    { "card": 7, "weight": 20 },
    { "card": 13, "weight": 64 },
    { "card": 26, "weight": 16 },
    { "card": 27, "weight": 16 },
    { "card": 31, "weight": 16 },
    { "card": 32, "weight": 8 },
    { "card": 36, "weight": 16 },
    { "card": 41, "weight": 20 },
    { "card": 43, "weight": 16 },
    { "card": 44, "weight": 20 },
    { "card": 46, "weight": 16 },
    { "card": 49, "weight": 16 },
    { "card": 51, "weight": 16 },
    { "card": 54, "weight": 20 },
    { "card": 55, "weight": 16 },
    { "card": 60, "weight": 8 },
    { "card": 62, "weight": 80 },
    { "card": 63, "weight": 2 },
    { "card": 64, "weight": 8 },
    { "card": 66, "weight": 16 },
    { "card": 70, "weight": 20 },
    { "card": 71, "weight": 16 },
    { "card": 77, "weight": 16 },
    { "card": 81, "weight": 8 },
    { "card": 95, "weight": 12 },
    { "card": 115, "weight": 8 },
    { "card": 117, "weight": 64 },
    { "card": 121, "weight": 8 },
    { "card": 125, "weight": 64 },
    { "card": 136, "weight": 16 },
    { "card": 149, "weight": 16 },
    { "card": 151, "weight": 16 },
    { "card": 163, "weight": 16 },
    { "card": 166, "weight": 16 },
    { "card": 168, "weight": 12 },
    { "card": 170, "weight": 8 },
    { "card": 186, "weight": 48 },
    { "card": 193, "weight": 16 },
    { "card": 194, "weight": 16 },
    { "card": 207, "weight": 1 },
    { "card": 216, "weight": 16 },
    { "card": 230, "weight": 16 },
    { "card": 233, "weight": 8 },
    { "card": 234, "weight": 8 },
    { "card": 241, "weight": 8 },
    { "card": 249, "weight": 16 },
    { "card": 255, "weight": 16 },
    { "card": 272, "weight": 1 },
    { "card": 275, "weight": 16 },
    { "card": 281, "weight": 16 },
    { "card": 287, "weight": 16 },
    { "card": 297, "weight": 16 },
    { "card": 300, "weight": 1 },
    { "card": 316, "weight": 20 },
    { "card": 317, "weight": 20 },
    { "card": 318, "weight": 80 },
    { "card": 321, "weight": 20 },
    { "card": 332, "weight": 20 },
    { "card": 336, "weight": 20 },
    { "card": 340, "weight": 20 },
    { "card": 349, "weight": 20 },
    { "card": 351, "weight": 8 },
    { "card": 352, "weight": 8 },
    { "card": 353, "weight": 16 },
    { "card": 363, "weight": 8 },
    { "card": 377, "weight": 8 },
    { "card": 379, "weight": 8 },
    { "card": 381, "weight": 8 },
    { "card": 384, "weight": 16 },
    { "card": 386, "weight": 1 },
    { "card": 412, "weight": 16 },
    { "card": 415, "weight": 20 },
    { "card": 416, "weight": 20 },
    { "card": 418, "weight": 16 },
    { "card": 430, "weight": 8 },
    { "card": 433, "weight": 20 },
    { "card": 440, "weight": 16 },
    { "card": 447, "weight": 16 },
    { "card": 454, "weight": 16 },
    { "card": 456, "weight": 16 },
    { "card": 459, "weight": 16 },
    { "card": 462, "weight": 8 },
    { "card": 466, "weight": 40 },
    { "card": 470, "weight": 16 },
    { "card": 474, "weight": 8 },
    { "card": 497, "weight": 16 },
    { "card": 502, "weight": 8 },
    { "card": 507, "weight": 8 },
    { "card": 511, "weight": 16 },
    { "card": 512, "weight": 16 },
    { "card": 515, "weight": 16 },
    { "card": 523, "weight": 8 },
    { "card": 532, "weight": 8 },
    { "card": 535, "weight": 20 },
    { "card": 538, "weight": 1 },
    { "card": 551, "weight": 8 },
    { "card": 552, "weight": 1 },
    { "card": 578, "weight": 20 },
    { "card": 581, "weight": 40 },
    { "card": 583, "weight": 12 },
    { "card": 587, "weight": 16 },
    { "card": 595, "weight": 48 },
    { "card": 596, "weight": 8 },
    { "card": 597, "weight": 16 },
    { "card": 607, "weight": 20 },
    { "card": 608, "weight": 8 },
    { "card": 623, "weight": 16 },
    { "card": 625, "weight": 16 },
    { "card": 626, "weight": 16 },
    { "card": 630, "weight": 16 },
    { "card": 631, "weight": 8 },
    { "card": 634, "weight": 12 },
    { "card": 636, "weight": 32 },
    { "card": 647, "weight": 8 },
    { "card": 649, "weight": 12 },
    { "card": 672, "weight": 20 },
    { "card": 683, "weight": 20 },
    { "card": 690, "weight": 20 }
  ],
  "drops": {
    "S/A-POW": [
      { "card": 2, "weight": 32 },
      { "card": 6, "weight": 32 },
      { "card": 13, "weight": 94 },
      { "card": 20, "weight": 8 },
      { "card": 26, "weight": 32 },
      { "card": 27, "weight": 32 },
      { "card": 31, "weight": 32 },
      { "card": 32, "weight": 32 },
      { "card": 36, "weight": 32 },
      { "card": 41, "weight": 32 },
      { "card": 43, "weight": 32 },
      { "card": 44, "weight": 32 },
      { "card": 46, "weight": 32 },
      { "card": 49, "weight": 32 },
      { "card": 54, "weight": 32 },
      { "card": 55, "weight": 32 },
      { "card": 70, "weight": 32 },
      { "card": 71, "weight": 32 },
      { "card": 78, "weight": 32 },
      { "card": 81, "weight": 30 },
      { "card": 83, "weight": 30 },
      { "card": 86, "weight": 30 },
      { "card": 91, "weight": 30 },
      { "card": 95, "weight": 30 },
      { "card": 125, "weight": 94 },
      { "card": 127, "weight": 30 },
      { "card": 136, "weight": 30 },
      { "card": 149, "weight": 30 },
      { "card": 168, "weight": 30 },
      { "card": 170, "weight": 30 },
      { "card": 186, "weight": 62 },
      { "card": 207, "weight": 62 },
      { "card": 230, "weight": 30 },
      { "card": 272, "weight": 62 },
      { "card": 300, "weight": 62 },
      { "card": 307, "weight": 18 },
      { "card": 332, "weight": 40 },
      { "card": 368, "weight": 30 },
      { "card": 379, "weight": 30 },
      { "card": 405, "weight": 30 },
      { "card": 412, "weight": 30 },
      { "card": 415, "weight": 30 },
      { "card": 416, "weight": 30 },
      { "card": 460, "weight": 30 },
      { "card": 462, "weight": 30 },
      { "card": 466, "weight": 94 },
      { "card": 511, "weight": 30 },
      { "card": 512, "weight": 30 },
      { "card": 538, "weight": 62 },
      { "card": 552, "weight": 62 },
      { "card": 597, "weight": 30 },
      { "card": 636, "weight": 94 },
      { "card": 648, "weight": 30 }
    ],
    "B/C/D": [
      { "card": 6, "weight": 40 },
      { "card": 13, "weight": 120 },
      { "card": 20, "weight": 10 },
      { "card": 26, "weight": 40 },
      { "card": 27, "weight": 40 },
      { "card": 31, "weight": 40 },
      { "card": 36, "weight": 40 },
      { "card": 41, "weight": 40 },
      { "card": 43, "weight": 40 },
      { "card": 44, "weight": 40 },
      { "card": 46, "weight": 40 },
      { "card": 49, "weight": 40 },
      { "card": 54, "weight": 40 },
      { "card": 55, "weight": 40 },
      { "card": 70, "weight": 40 },
      { "card": 71, "weight": 40 },
      { "card": 95, "weight": 40 },
      { "card": 125, "weight": 120 },
      { "card": 136, "weight": 40 },
      { "card": 149, "weight": 40 },
      { "card": 168, "weight": 40 },
      { "card": 186, "weight": 80 },
      { "card": 207, "weight": 80 },
      { "card": 230, "weight": 40 },
      { "card": 272, "weight": 80 },
      { "card": 300, "weight": 80 },
      { "card": 307, "weight": 26 },
      { "card": 312, "weight": 26 },
      { "card": 316, "weight": 60 },
      { "card": 332, "weight": 60 },
      { "card": 412, "weight": 40 },
      { "card": 415, "weight": 40 },
      { "card": 416, "weight": 40 },
      { "card": 466, "weight": 120 },
      { "card": 511, "weight": 40 },
      { "card": 512, "weight": 40 },
      { "card": 538, "weight": 80 },
      { "card": 552, "weight": 80 },
      { "card": 597, "weight": 40 },
      { "card": 684, "weight": 26 }
    ],
    "S/A-TEC": [
      { "card": 13, "weight": 136 },
      { "card": 20, "weight": 10 },
      { "card": 41, "weight": 46 },
      { "card": 44, "weight": 46 },
      { "card": 54, "weight": 46 },
      { "card": 70, "weight": 46 },
      { "card": 78, "weight": 46 },
      { "card": 125, "weight": 132 },
      { "card": 149, "weight": 45 },
      { "card": 186, "weight": 90 },
      { "card": 207, "weight": 90 },
      { "card": 272, "weight": 90 },
      { "card": 300, "weight": 90 },
      { "card": 307, "weight": 32 },
      { "card": 312, "weight": 32 },
      { "card": 313, "weight": 32 },
      { "card": 316, "weight": 64 },
      { "card": 317, "weight": 72 },
      { "card": 321, "weight": 32 },
      { "card": 325, "weight": 32 },
      { "card": 327, "weight": 32 },
      { "card": 332, "weight": 64 },
      { "card": 339, "weight": 32 },
      { "card": 340, "weight": 32 },
      { "card": 341, "weight": 32 },
      { "card": 344, "weight": 32 },
      { "card": 345, "weight": 32 },
      { "card": 349, "weight": 32 },
      { "card": 412, "weight": 45 },
      { "card": 415, "weight": 45 },
      { "card": 416, "weight": 45 },
      { "card": 538, "weight": 90 },
      { "card": 552, "weight": 90 },
      { "card": 672, "weight": 64 },
      { "card": 676, "weight": 32 },
      { "card": 684, "weight": 36 },
      { "card": 685, "weight": 36 },
      { "card": 687, "weight": 36 },
      { "card": 690, "weight": 32 }
    ]
  }
}
