{
  "$schema": "../../schema/duelist.schema.json",
  "id": "jono-2nd",
  "number": 19,
  "name": "Jono 2nd",
  "portrait": {
    "source": "yugipedia",
    "url": "https://ms.yugipedia.com/e/e1/Jono-FMR.png",
    "width": 178,
    "height": 169
  },
  "deck": [
    { "card": 4, "weight": 8 },
    { "card": 9, "weight": 8 },
    { "card": 12, "weight": 72 },
    { "card": 14, "weight": 72 },
    { "card": 15, "weight": 72 },
    { "card": 16, "weight": 36 },
    { "card": 28, "weight": 40 },
    { "card": 29, "weight": 36 },
    { "card": 40, "weight": 36 },
    { "card": 43, "weight": 72 },
    { "card": 51, "weight": 72 },
    { "card": 61, "weight": 72 },
    { "card": 64, "weight": 72 },
    { "card": 68, "weight": 72 },
    { "card": 78, "weight": 72 },
    { "card": 82, "weight": 72 },
    { "card": 100, "weight": 36 },
    { "card": 101, "weight": 36 },
    { "card": 123, "weight": 8 },
    { "card": 133, "weight": 36 },
    { "card": 167, "weight": 8 },
    { "card": 176, "weight": 8 },
    { "card": 192, "weight": 8 },
    { "card": 210, "weight": 8 },
    { "card": 289, "weight": 8 },
    { "card": 291, "weight": 36 },
    { "card": 324, "weight": 80 },
    { "card": 330, "weight": 70 },
    { "card": 331, "weight": 70 },
    { "card": 332, "weight": 70 },
    { "card": 333, "weight": 70 },
    { "card": 334, "weight": 70 },
    { "card": 335, "weight": 70 },
    { "card": 347, "weight": 100 },
    { "card": 387, "weight": 8 },
    { "card": 389, "weight": 72 },
    { "card": 397, "weight": 8 },
    { "card": 402, "weight": 8 },
    { "card": 411, "weight": 8 },
    { "card": 428, "weight": 8 },
    { "card": 469, "weight": 8 },
    { "card": 473, "weight": 36 },
    { "card": 484, "weight": 8 },
    { "card": 504, "weight": 8 },
    { "card": 547, "weight": 8 },
    { "card": 548, "weight": 8 },
    { "card": 558, "weight": 8 },
    { "card": 635, "weight": 8 },
    { "card": 644, "weight": 8 },
    { "card": 651, "weight": 80 },
    { "card": 654, "weight": 80 }
  ],
  "drops": {
    "S/A-POW": [
      { "card": 4, "weight": 22 },
      { "card": 12, "weight": 24 },
      { "card": 14, "weight": 24 },
      { "card": 15, "weight": 24 },
      { "card": 20, "weight": 8 },
      { "card": 29, "weight": 22 },
      { "card": 43, "weight": 22 },
      { "card": 50, "weight": 44 },
      { "card": 61, "weight": 22 },
      { "card": 68, "weight": 24 },
      { "card": 78, "weight": 22 },
      { "card": 82, "weight": 24 },
      { "card": 100, "weight": 22 },
      { "card": 104, "weight": 44 },
      { "card": 105, "weight": 44 },
      { "card": 122, "weight": 44 },
      { "card": 130, "weight": 44 },
      { "card": 135, "weight": 44 },
      { "card": 137, "weight": 44 },
      { "card": 152, "weight": 44 },
      { "card": 154, "weight": 44 },
      { "card": 174, "weight": 44 },
      { "card": 182, "weight": 44 },
      { "card": 185, "weight": 44 },
      { "card": 191, "weight": 44 },
      { "card": 197, "weight": 44 },
      { "card": 202, "weight": 44 },
      { "card": 207, "weight": 44 },
      { "card": 210, "weight": 44 },
      { "card": 214, "weight": 44 },
      { "card": 237, "weight": 44 },
      { "card": 242, "weight": 42 },
      { "card": 245, "weight": 42 },
      { "card": 268, "weight": 42 },
      { "card": 333, "weight": 16 },
      { "card": 389, "weight": 4 },
      { "card": 410, "weight": 42 },
      { "card": 420, "weight": 42 },
      { "card": 422, "weight": 42 },
      { "card": 436, "weight": 42 },
      { "card": 444, "weight": 42 },
      { "card": 485, "weight": 42 },
      { "card": 486, "weight": 42 },
      { "card": 488, "weight": 42 },
      { "card": 492, "weight": 42 },
      { "card": 501, "weight": 42 },
      { "card": 516, "weight": 42 },
      { "card": 524, "weight": 42 },
      { "card": 549, "weight": 42 },
      { "card": 558, "weight": 42 },
      { "card": 563, "weight": 42 },
      { "card": 579, "weight": 42 },
      { "card": 589, "weight": 42 },
      { "card": 598, "weight": 42 },
      { "card": 611, "weight": 42 },
      { "card": 713, "weight": 8 }
    ],
    "B/C/D": [
      { "card": 4, "weight": 23 },
      { "card": 20, "weight": 6 },
      { "card": 29, "weight": 23 },
      { "card": 43, "weight": 23 },
      { "card": 50, "weight": 46 },
      { "card": 61, "weight": 23 },
      { "card": 78, "weight": 23 },
      { "card": 100, "weight": 23 },
      { "card": 104, "weight": 46 },
      { "card": 105, "weight": 46 },
      { "card": 122, "weight": 46 },
      { "card": 130, "weight": 46 },
      { "card": 135, "weight": 46 },
      { "card": 137, "weight": 46 },
      { "card": 152, "weight": 46 },
      { "card": 154, "weight": 46 },
      { "card": 174, "weight": 46 },
      { "card": 182, "weight": 46 },
      { "card": 185, "weight": 46 },
      { "card": 191, "weight": 46 },
      { "card": 197, "weight": 46 },
      { "card": 202, "weight": 46 },
      { "card": 207, "weight": 46 },
      { "card": 210, "weight": 46 },
      { "card": 214, "weight": 46 },
      { "card": 237, "weight": 46 },
      { "card": 242, "weight": 44 },
      { "card": 245, "weight": 44 },
      { "card": 268, "weight": 44 },
      { "card": 333, "weight": 22 },
      { "card": 344, "weight": 20 },
      { "card": 410, "weight": 44 },
      { "card": 420, "weight": 44 },
      { "card": 422, "weight": 44 },
      { "card": 436, "weight": 44 },
      { "card": 444, "weight": 44 },
      { "card": 485, "weight": 44 },
      { "card": 486, "weight": 44 },
      { "card": 488, "weight": 44 },
      { "card": 492, "weight": 44 },
      { "card": 501, "weight": 44 },
      { "card": 516, "weight": 44 },
      { "card": 524, "weight": 44 },
      { "card": 549, "weight": 44 },
      { "card": 558, "weight": 44 },
      { "card": 563, "weight": 44 },
      { "card": 579, "weight": 44 },
      { "card": 589, "weight": 44 },
      { "card": 598, "weight": 44 },
      { "card": 611, "weight": 44 },
      { "card": 651, "weight": 20 }
    ],
    "S/A-TEC": [
      { "card": 4, "weight": 18 },
      { "card": 20, "weight": 4 },
      { "card": 29, "weight": 18 },
      { "card": 43, "weight": 18 },
      { "card": 50, "weight": 38 },
      { "card": 61, "weight": 18 },
      { "card": 78, "weight": 18 },
      { "card": 100, "weight": 18 },
      { "card": 104, "weight": 38 },
      { "card": 105, "weight": 38 },
      { "card": 122, "weight": 38 },
      { "card": 130, "weight": 38 },
      { "card": 135, "weight": 38 },
      { "card": 137, "weight": 38 },
      { "card": 152, "weight": 38 },
      { "card": 154, "weight": 38 },
      { "card": 174, "weight": 38 },
      { "card": 182, "weight": 38 },
      { "card": 185, "weight": 38 },
      { "card": 191, "weight": 38 },
      { "card": 197, "weight": 38 },
      { "card": 202, "weight": 38 },
      { "card": 207, "weight": 38 },
      { "card": 210, "weight": 38 },
      { "card": 214, "weight": 38 },
      { "card": 237, "weight": 38 },
      { "card": 242, "weight": 44 },
      { "card": 245, "weight": 44 },
      { "card": 268, "weight": 44 },
      { "card": 301, "weight": 20 },
      { "card": 302, "weight": 20 },
      { "card": 310, "weight": 21 },
      { "card": 311, "weight": 21 },
      { "card": 333, "weight": 20 },
      { "card": 336, "weight": 20 },
      { "card": 344, "weight": 22 },
      { "card": 345, "weight": 22 },
      { "card": 410, "weight": 44 },
      { "card": 420, "weight": 44 },
      { "card": 422, "weight": 44 },
      { "card": 436, "weight": 44 },
      { "card": 444, "weight": 44 },
      { "card": 485, "weight": 44 },
      { "card": 486, "weight": 44 },
      { "card": 488, "weight": 44 },
      { "card": 492, "weight": 44 },
      { "card": 501, "weight": 44 },
      { "card": 516, "weight": 44 },
      { "card": 524, "weight": 44 },
      { "card": 549, "weight": 44 },
      { "card": 558, "weight": 44 },
      { "card": 563, "weight": 44 },
      { "card": 579, "weight": 44 },
      { "card": 589, "weight": 44 },
      { "card": 598, "weight": 44 },
      { "card": 611, "weight": 44 },
      { "card": 651, "weight": 22 },
      { "card": 654, "weight": 22 },
      { "card": 677, "weight": 20 },
      { "card": 681, "weight": 16 }
    ]
  }
}
