{
  "$schema": "../../schema/duelist.schema.json",
  "id": "pegasus",
  "number": 15,
  "name": "Pegasus",
  "portrait": {
    "source": "yugipedia",
    "url": "https://ms.yugipedia.com/d/d0/Pegasus-FMR.png",
    "width": 228,
    "height": 188
  },
  "deck": [
    { "card": 3, "weight": 8 },
    { "card": 4, "weight": 8 },
    { "card": 7, "weight": 8 },
    { "card": 10, "weight": 8 },
    { "card": 13, "weight": 8 },
    { "card": 14, "weight": 8 },
    { "card": 15, "weight": 32 },
    { "card": 23, "weight": 8 },
    { "card": 26, "weight": 8 },
    { "card": 27, "weight": 8 },
    { "card": 29, "weight": 8 },
    { "card": 31, "weight": 8 },
    { "card": 40, "weight": 8 },
    { "card": 42, "weight": 48 },
    { "card": 44, "weight": 8 },
    { "card": 45, "weight": 8 },
    { "card": 46, "weight": 8 },
    { "card": 47, "weight": 8 },
    { "card": 61, "weight": 8 },
    { "card": 62, "weight": 8 },
    { "card": 64, "weight": 8 },
    { "card": 65, "weight": 8 },
    { "card": 68, "weight": 8 },
    { "card": 91, "weight": 8 },
    { "card": 94, "weight": 8 },
    { "card": 113, "weight": 8 },
    { "card": 117, "weight": 8 },
    { "card": 121, "weight": 8 },
    { "card": 122, "weight": 8 },
    { "card": 125, "weight": 8 },
    { "card": 155, "weight": 8 },
    { "card": 159, "weight": 8 },
    { "card": 163, "weight": 8 },
    { "card": 168, "weight": 8 },
    { "card": 186, "weight": 8 },
    { "card": 187, "weight": 8 },
    { "card": 188, "weight": 8 },
    { "card": 189, "weight": 8 },
    { "card": 200, "weight": 8 },
    { "card": 201, "weight": 8 },
    { "card": 202, "weight": 8 },
    { "card": 207, "weight": 8 },
    { "card": 212, "weight": 8 },
    { "card": 219, "weight": 8 },
    { "card": 246, "weight": 8 },
    { "card": 248, "weight": 8 },
    { "card": 252, "weight": 8 },
    { "card": 255, "weight": 8 },
    { "card": 272, "weight": 8 },
    { "card": 282, "weight": 8 },
    { "card": 287, "weight": 8 },
    { "card": 296, "weight": 8 },
    { "card": 298, "weight": 8 },
    { "card": 300, "weight": 8 },
    { "card": 329, "weight": 120 },
    { "card": 337, "weight": 160 },
    { "card": 357, "weight": 48 },
    { "card": 376, "weight": 32 },
    { "card": 381, "weight": 48 },
    { "card": 382, "weight": 48 },
    { "card": 383, "weight": 48 },
    { "card": 384, "weight": 48 },
    { "card": 385, "weight": 48 },
    { "card": 403, "weight": 8 },
    { "card": 404, "weight": 8 },
    { "card": 423, "weight": 32 },
    { "card": 464, "weight": 8 },
    { "card": 466, "weight": 8 },
    { "card": 468, "weight": 8 },
    { "card": 473, "weight": 24 },
    { "card": 481, "weight": 8 },
    { "card": 482, "weight": 24 },
    { "card": 487, "weight": 8 },
    { "card": 491, "weight": 8 },
    { "card": 496, "weight": 8 },
    { "card": 527, "weight": 8 },
    { "card": 528, "weight": 48 },
    { "card": 538, "weight": 8 },
    { "card": 541, "weight": 8 },
    { "card": 552, "weight": 8 },
    { "card": 561, "weight": 8 },
    { "card": 565, "weight": 24 },
    { "card": 577, "weight": 64 },
    { "card": 581, "weight": 8 },
    { "card": 587, "weight": 8 },
    { "card": 595, "weight": 8 },
    { "card": 597, "weight": 8 },
    { "card": 598, "weight": 8 },
    { "card": 603, "weight": 8 },
    { "card": 604, "weight": 8 },
    { "card": 607, "weight": 8 },
    { "card": 629, "weight": 8 },
    { "card": 636, "weight": 8 },
    { "card": 642, "weight": 8 },
    { "card": 668, "weight": 120 },
    { "card": 672, "weight": 120 },
    { "card": 684, "weight": 120 },
    { "card": 690, "weight": 120 },
    { "card": 712, "weight": 48 },
    { "card": 713, "weight": 8 }
  ],
  "drops": {
    "S/A-POW": [
      { "card": 3, "weight": 34 },
      { "card": 4, "weight": 34 },
      { "card": 10, "weight": 34 },
      { "card": 13, "weight": 34 },
      { "card": 19, "weight": 8 },
      { "card": 23, "weight": 34 },
      { "card": 26, "weight": 34 },
      { "card": 27, "weight": 34 },
      { "card": 29, "weight": 34 },
      { "card": 31, "weight": 34 },
      { "card": 40, "weight": 66 },
      { "card": 44, "weight": 36 },
      { "card": 45, "weight": 36 },
      { "card": 46, "weight": 36 },
      { "card": 47, "weight": 36 },
      { "card": 61, "weight": 36 },
      { "card": 65, "weight": 36 },
      { "card": 91, "weight": 36 },
      { "card": 113, "weight": 36 },
      { "card": 117, "weight": 8 },
      { "card": 121, "weight": 36 },
      { "card": 122, "weight": 36 },
      { "card": 125, "weight": 36 },
      { "card": 155, "weight": 36 },
      { "card": 159, "weight": 36 },
      { "card": 168, "weight": 36 },
      { "card": 186, "weight": 36 },
      { "card": 187, "weight": 36 },
      { "card": 188, "weight": 36 },
      { "card": 189, "weight": 36 },
      { "card": 200, "weight": 36 },
      { "card": 201, "weight": 36 },
      { "card": 202, "weight": 36 },
      { "card": 207, "weight": 36 },
      { "card": 212, "weight": 36 },
      { "card": 219, "weight": 36 },
      { "card": 246, "weight": 36 },
      { "card": 248, "weight": 36 },
      { "card": 255, "weight": 36 },
      { "card": 272, "weight": 36 },
      { "card": 282, "weight": 36 },
      { "card": 296, "weight": 36 },
      { "card": 298, "weight": 36 },
      { "card": 300, "weight": 36 },
      { "card": 330, "weight": 30 },
      { "card": 334, "weight": 30 },
      { "card": 404, "weight": 8 },
      { "card": 466, "weight": 36 },
      { "card": 481, "weight": 36 },
      { "card": 496, "weight": 36 },
      { "card": 527, "weight": 36 },
      { "card": 538, "weight": 36 },
      { "card": 552, "weight": 36 },
      { "card": 595, "weight": 8 },
      { "card": 597, "weight": 36 },
      { "card": 598, "weight": 36 },
      { "card": 604, "weight": 36 },
      { "card": 629, "weight": 36 },
      { "card": 636, "weight": 36 },
      { "card": 642, "weight": 36 }
    ],
    "B/C/D": [
      { "card": 3, "weight": 44 },
      { "card": 4, "weight": 40 },
      { "card": 10, "weight": 44 },
      { "card": 19, "weight": 12 },
      { "card": 23, "weight": 44 },
      { "card": 29, "weight": 40 },
      { "card": 40, "weight": 80 },
      { "card": 45, "weight": 80 },
      { "card": 47, "weight": 38 },
      { "card": 61, "weight": 38 },
      { "card": 65, "weight": 38 },
      { "card": 113, "weight": 38 },
      { "card": 117, "weight": 12 },
      { "card": 121, "weight": 40 },
      { "card": 122, "weight": 38 },
      { "card": 155, "weight": 38 },
      { "card": 159, "weight": 38 },
      { "card": 186, "weight": 40 },
      { "card": 187, "weight": 38 },
      { "card": 188, "weight": 38 },
      { "card": 189, "weight": 38 },
      { "card": 200, "weight": 38 },
      { "card": 201, "weight": 40 },
      { "card": 202, "weight": 38 },
      { "card": 207, "weight": 38 },
      { "card": 212, "weight": 38 },
      { "card": 219, "weight": 38 },
      { "card": 246, "weight": 40 },
      { "card": 248, "weight": 40 },
      { "card": 255, "weight": 38 },
      { "card": 272, "weight": 38 },
      { "card": 282, "weight": 38 },
      { "card": 296, "weight": 38 },
      { "card": 298, "weight": 38 },
      { "card": 300, "weight": 38 },
      { "card": 315, "weight": 32 },
      { "card": 325, "weight": 32 },
      { "card": 330, "weight": 64 },
      { "card": 334, "weight": 64 },
      { "card": 404, "weight": 12 },
      { "card": 481, "weight": 38 },
      { "card": 496, "weight": 38 },
      { "card": 527, "weight": 38 },
      { "card": 538, "weight": 38 },
      { "card": 552, "weight": 38 },
      { "card": 595, "weight": 12 },
      { "card": 598, "weight": 38 },
      { "card": 604, "weight": 38 },
      { "card": 629, "weight": 38 },
      { "card": 642, "weight": 38 },
      { "card": 652, "weight": 32 },
      { "card": 685, "weight": 64 }
    ],
    "S/A-TEC": [
      { "card": 4, "weight": 32 },
      { "card": 19, "weight": 8 },
      { "card": 29, "weight": 32 },
      { "card": 40, "weight": 64 },
      { "card": 45, "weight": 34 },
      { "card": 47, "weight": 34 },
      { "card": 61, "weight": 34 },
      { "card": 65, "weight": 34 },
      { "card": 113, "weight": 34 },
      { "card": 117, "weight": 6 },
      { "card": 122, "weight": 34 },
      { "card": 155, "weight": 34 },
      { "card": 159, "weight": 34 },
      { "card": 187, "weight": 34 },
      { "card": 188, "weight": 34 },
      { "card": 189, "weight": 34 },
      { "card": 200, "weight": 34 },
      { "card": 202, "weight": 34 },
      { "card": 207, "weight": 34 },
      { "card": 212, "weight": 34 },
      { "card": 219, "weight": 34 },
      { "card": 282, "weight": 36 },
      { "card": 296, "weight": 36 },
      { "card": 298, "weight": 36 },
      { "card": 300, "weight": 36 },
      { "card": 315, "weight": 36 },
      { "card": 316, "weight": 36 },
      { "card": 325, "weight": 36 },
      { "card": 329, "weight": 64 },
      { "card": 330, "weight": 64 },
      { "card": 334, "weight": 64 },
      { "card": 404, "weight": 8 },
      { "card": 481, "weight": 36 },
      { "card": 496, "weight": 36 },
      { "card": 527, "weight": 36 },
      { "card": 538, "weight": 36 },
      { "card": 595, "weight": 8 },
      { "card": 598, "weight": 36 },
      { "card": 604, "weight": 36 },
      { "card": 629, "weight": 36 },
      { "card": 642, "weight": 36 },
      { "card": 652, "weight": 36 },
      { "card": 657, "weight": 64 },
      { "card": 661, "weight": 2 },
      { "card": 665, "weight": 32 },
      { "card": 666, "weight": 32 },
      { "card": 668, "weight": 64 },
      { "card": 672, "weight": 32 },
      { "card": 676, "weight": 32 },
      { "card": 677, "weight": 32 },
      { "card": 685, "weight": 64 },
      { "card": 686, "weight": 64 },
      { "card": 687, "weight": 32 },
      { "card": 690, "weight": 32 },
      { "card": 693, "weight": 32 },
      { "card": 695, "weight": 32 },
      { "card": 699, "weight": 32 }
    ]
  }
}
