{
  "$schema": "../../schema/duelist.schema.json",
  "id": "kaiba",
  "number": 17,
  "name": "Kaiba",
  "portrait": {
    "source": "yugipedia",
    "url": "https://ms.yugipedia.com/2/2a/Kaiba-FMR.png",
    "width": 188,
    "height": 173
  },
  "deck": [
    { "card": 1, "weight": 45 },
    { "card": 3, "weight": 1 },
    { "card": 4, "weight": 1 },
    { "card": 5, "weight": 1 },
    { "card": 7, "weight": 1 },
    { "card": 10, "weight": 1 },
    { "card": 12, "weight": 24 },
    { "card": 14, "weight": 24 },
    { "card": 15, "weight": 18 },
    { "card": 23, "weight": 1 },
    { "card": 26, "weight": 1 },
    { "card": 31, "weight": 1 },
    { "card": 34, "weight": 1 },
    { "card": 42, "weight": 18 },
    { "card": 68, "weight": 24 },
    { "card": 69, "weight": 1 },
    { "card": 73, "weight": 24 },
    { "card": 74, "weight": 24 },
    { "card": 77, "weight": 1 },
    { "card": 84, "weight": 24 },
    { "card": 87, "weight": 24 },
    { "card": 88, "weight": 24 },
    { "card": 89, "weight": 16 },
    { "card": 91, "weight": 4 },
    { "card": 93, "weight": 32 },
    { "card": 94, "weight": 32 },
    { "card": 106, "weight": 24 },
    { "card": 111, "weight": 16 },
    { "card": 122, "weight": 1 },
    { "card": 124, "weight": 24 },
    { "card": 126, "weight": 24 },
    { "card": 131, "weight": 16 },
    { "card": 150, "weight": 24 },
    { "card": 168, "weight": 2 },
    { "card": 200, "weight": 1 },
    { "card": 204, "weight": 24 },
    { "card": 213, "weight": 32 },
    { "card": 286, "weight": 24 },
    { "card": 296, "weight": 1 },
    { "card": 298, "weight": 1 },
    { "card": 320, "weight": 32 },
    { "card": 336, "weight": 32 },
    { "card": 348, "weight": 32 },
    { "card": 355, "weight": 24 },
    { "card": 357, "weight": 32 },
    { "card": 362, "weight": 16 },
    { "card": 366, "weight": 16 },
    { "card": 375, "weight": 24 },
    { "card": 376, "weight": 16 },
    { "card": 377, "weight": 2 },
    { "card": 379, "weight": 2 },
    { "card": 382, "weight": 16 },
    { "card": 383, "weight": 64 },
    { "card": 389, "weight": 24 },
    { "card": 396, "weight": 32 },
    { "card": 400, "weight": 24 },
    { "card": 403, "weight": 24 },
    { "card": 413, "weight": 32 },
    { "card": 423, "weight": 8 },
    { "card": 425, "weight": 24 },
    { "card": 434, "weight": 32 },
    { "card": 439, "weight": 24 },
    { "card": 441, "weight": 24 },
    { "card": 449, "weight": 24 },
    { "card": 458, "weight": 24 },
    { "card": 464, "weight": 24 },
    { "card": 468, "weight": 32 },
    { "card": 473, "weight": 16 },
    { "card": 482, "weight": 16 },
    { "card": 487, "weight": 32 },
    { "card": 491, "weight": 32 },
    { "card": 494, "weight": 32 },
    { "card": 495, "weight": 32 },
    { "card": 508, "weight": 32 },
    { "card": 513, "weight": 32 },
    { "card": 519, "weight": 24 },
    { "card": 525, "weight": 24 },
    { "card": 528, "weight": 16 },
    { "card": 542, "weight": 16 },
    { "card": 554, "weight": 23 },
    { "card": 557, "weight": 32 },
    { "card": 561, "weight": 1 },
    { "card": 565, "weight": 16 },
    { "card": 577, "weight": 8 },
    { "card": 593, "weight": 32 },
    { "card": 603, "weight": 1 },
    { "card": 614, "weight": 16 },
    { "card": 617, "weight": 24 },
    { "card": 622, "weight": 24 },
    { "card": 632, "weight": 24 },
    { "card": 633, "weight": 24 },
    { "card": 637, "weight": 24 },
    { "card": 638, "weight": 24 },
    { "card": 639, "weight": 32 },
    { "card": 641, "weight": 24 },
    { "card": 650, "weight": 32 },
    { "card": 661, "weight": 64 },
    { "card": 669, "weight": 32 },
    { "card": 675, "weight": 45 }
  ],
  "drops": {
    "S/A-POW": [
      { "card": 3, "weight": 140 },
      { "card": 4, "weight": 70 },
      { "card": 5, "weight": 140 },
      { "card": 10, "weight": 70 },
      { "card": 19, "weight": 12 },
      { "card": 23, "weight": 140 },
      { "card": 26, "weight": 152 },
      { "card": 31, "weight": 80 },
      { "card": 34, "weight": 142 },
      { "card": 66, "weight": 12 },
      { "card": 77, "weight": 130 },
      { "card": 91, "weight": 148 },
      { "card": 117, "weight": 12 },
      { "card": 122, "weight": 64 },
      { "card": 128, "weight": 12 },
      { "card": 151, "weight": 12 },
      { "card": 163, "weight": 12 },
      { "card": 168, "weight": 80 },
      { "card": 200, "weight": 64 },
      { "card": 216, "weight": 12 },
      { "card": 249, "weight": 12 },
      { "card": 275, "weight": 12 },
      { "card": 281, "weight": 12 },
      { "card": 287, "weight": 12 },
      { "card": 296, "weight": 64 },
      { "card": 297, "weight": 12 },
      { "card": 298, "weight": 64 },
      { "card": 333, "weight": 60 },
      { "card": 379, "weight": 140 },
      { "card": 404, "weight": 12 },
      { "card": 418, "weight": 12 },
      { "card": 448, "weight": 12 },
      { "card": 454, "weight": 12 },
      { "card": 456, "weight": 12 },
      { "card": 498, "weight": 12 },
      { "card": 517, "weight": 12 },
      { "card": 578, "weight": 12 },
      { "card": 587, "weight": 12 },
      { "card": 595, "weight": 12 },
      { "card": 614, "weight": 12 },
      { "card": 621, "weight": 12 },
      { "card": 630, "weight": 12 }
    ],
    "B/C/D": [
      { "card": 3, "weight": 174 },
      { "card": 4, "weight": 86 },
      { "card": 5, "weight": 174 },
      { "card": 10, "weight": 86 },
      { "card": 19, "weight": 12 },
      { "card": 23, "weight": 174 },
      { "card": 34, "weight": 174 },
      { "card": 66, "weight": 12 },
      { "card": 77, "weight": 174 },
      { "card": 117, "weight": 12 },
      { "card": 122, "weight": 84 },
      { "card": 128, "weight": 13 },
      { "card": 151, "weight": 13 },
      { "card": 163, "weight": 13 },
      { "card": 200, "weight": 84 },
      { "card": 216, "weight": 13 },
      { "card": 249, "weight": 13 },
      { "card": 275, "weight": 13 },
      { "card": 281, "weight": 13 },
      { "card": 287, "weight": 13 },
      { "card": 296, "weight": 84 },
      { "card": 297, "weight": 13 },
      { "card": 298, "weight": 84 },
      { "card": 302, "weight": 48 },
      { "card": 329, "weight": 48 },
      { "card": 333, "weight": 84 },
      { "card": 404, "weight": 13 },
      { "card": 418, "weight": 13 },
      { "card": 448, "weight": 13 },
      { "card": 454, "weight": 13 },
      { "card": 456, "weight": 13 },
      { "card": 498, "weight": 13 },
      { "card": 517, "weight": 13 },
      { "card": 578, "weight": 13 },
      { "card": 587, "weight": 13 },
      { "card": 595, "weight": 13 },
      { "card": 614, "weight": 13 },
      { "card": 621, "weight": 13 },
      { "card": 630, "weight": 13 },
      { "card": 685, "weight": 84 },
      { "card": 687, "weight": 84 }
    ],
    "S/A-TEC": [
      { "card": 4, "weight": 86 },
      { "card": 5, "weight": 174 },
      { "card": 19, "weight": 12 },
      { "card": 66, "weight": 12 },
      { "card": 117, "weight": 12 },
      { "card": 122, "weight": 84 },
      { "card": 128, "weight": 12 },
      { "card": 151, "weight": 12 },
      { "card": 163, "weight": 12 },
      { "card": 200, "weight": 84 },
      { "card": 216, "weight": 12 },
      { "card": 249, "weight": 12 },
      { "card": 275, "weight": 12 },
      { "card": 281, "weight": 12 },
      { "card": 287, "weight": 12 },
      { "card": 296, "weight": 84 },
      { "card": 297, "weight": 12 },
      { "card": 298, "weight": 84 },
      { "card": 302, "weight": 56 },
      { "card": 303, "weight": 56 },
      { "card": 329, "weight": 56 },
      { "card": 333, "weight": 88 },
      { "card": 404, "weight": 12 },
      { "card": 418, "weight": 12 },
      { "card": 448, "weight": 12 },
      { "card": 454, "weight": 12 },
      { "card": 456, "weight": 12 },
      { "card": 498, "weight": 12 },
      { "card": 517, "weight": 12 },
      { "card": 578, "weight": 12 },
      { "card": 587, "weight": 12 },
      { "card": 595, "weight": 12 },
      { "card": 614, "weight": 12 },
      { "card": 621, "weight": 12 },
      { "card": 630, "weight": 12 },
      { "card": 653, "weight": 80 },
      { "card": 661, "weight": 40 },
      { "card": 665, "weight": 40 },
      { "card": 666, "weight": 40 },
      { "card": 668, "weight": 40 },
      { "card": 672, "weight": 40 },
      { "card": 676, "weight": 40 },
      { "card": 677, "weight": 40 },
      { "card": 679, "weight": 40 },
      { "card": 685, "weight": 84 },
      { "card": 686, "weight": 84 },
      { "card": 687, "weight": 84 },
      { "card": 688, "weight": 84 },
      { "card": 690, "weight": 40 },
      { "card": 693, "weight": 40 },
      { "card": 695, "weight": 40 },
      { "card": 699, "weight": 40 }
    ]
  }
}
